object_id,name,description,group,img_name
10619966,Подвеска с привесками,,Археология,27827898.jpg
10619963,Пряжка,,Археология,27827852.jpg
10679777,Фрагмент тигля,,Археология,7876257.jpg
10670559,Височное кольцо,,Археология,27840595.jpg
43796281,Стенка сосуда (фрагмент) с ямочным орнаментом,,Археология,53886514.jpg
10343728,"Край сковородки красноглиняной, лепной, с плоскимдном. Полный профиль. III в.",,Археология,41224952.jpg
47854153,Фрагмент стенки сосуда.,С ямочно-гребенчатой орнаментацией.,Археология,59289774.jpg
47728742,Пряслице розового цвета,,Археология,59108962.jpg
43789482,Пряслице  из коллекции предметов с жертвенного места Чёртово городище у станции Исеть,,Археология,53877326.jpg
43793540,Стенка сосуда (фрагмент) прямого венчика с сетчатой поверхностью  и ямчатым орнаментом,"с сетчатой поверхностью и ямчатым орнаментом. Срез прямой, по нему косые оттиски гребенчатого штампа. на внутренней стороне - расчёсы.",Археология,53883116.jpg
43795683,Бусина,фаянсовая.,Археология,53885698.jpg
10670553,Щиток подвески,,Археология,27827883.jpg
10669758,Браслет (фрагмент),"стеклянный, гладкий, темно-зеленый.",Археология,7861956.jpg
43793424,Образец керамики с ямочно-гребенчатым орнаментом,Коллекция керамики с ямочно-гребенчатым орнаментом. Собрана в местности Старцев остров Белозерского района.,Археология,53882985.jpg
46774383,Бусина,"группа - одноцветные, отдел - круглые, тип - цилиндрические, с усеченно-конусовидными фасками. Стекло синее, прозрачное.",Археология,57805336.jpg
10332622,Край горла гераклейской амфоры  [AKOPNO∑] . III -II в.до н.э.,,Археология,41222605.jpg
43789467, Фрагмент стенки сосуда из коллекции предметов с жертвенного места Чёртово городище у станции Исеть,,Археология,53877312.jpg
49036495,Фрагмент керамики,,Археология,61024732.jpg
46778479,Обломок,"кремневый, серо-голубого цвета.",Археология,57810169.jpg
43789455, Кусок железа (меди?) из коллекции предметов с жертвенного места Чёртово городище у станции Исеть,,Археология,53877301.jpg
10669769,Браслет (фрагмент),"стеклянный, гладкий, темно-коричневый.",Археология,7861970.jpg
43785750,Осколок обсидиана,,Археология,53871323.jpg
10332807,Край горла гераклейской амфоры с клеймом. ,,Археология,41226883.jpg
46774366,Бусина,сердоликовая.,Археология,57805319.jpg
46780595,Чешуйка,"кремневая, серо-голубого цвета.",Археология,57812965.jpg
43788607,"Сосуд красноглиняный, венчик (фрагмент)",,Археология,53875260.jpg
46775505,Бусина,"группа - одноцветные, отдел - круглые, тип - кольцеобразные, бисер (?). Стекло зелено-голубое, полупрозрачное.",Археология,57806632.jpg
10670567,Височное кольцо (фрагмент),,Археология,27840510.jpg
43794720,"Предмет археологии. Фрагмент стенки сосуда. Западная Сибирь, Южно-таёжное Прииртышье, культовое место Усть-Тара ХХХIII, V тыс. до н. э. Автор раскопок Скандаков И. Е., 1991 г.","Фрагмент керамического сосуда аморфной формы. Цвет внешнего и внутреннего бортов светло-коричневый. Орнаментирован по внешнему борту. Два горизонтальных ряда протащенной палочки. Поверх наложен горизонтальный зигзагообразный ряд овальных ямок 0,9 х 0,5 см, не образующих на внутреннем борте жемчужины. Ниже - два горизонтальных ряда отступающей палочки.",Археология,53884519.jpg
46770800,Фрагмент лепного сосуда серо-коричневого цвета,,Археология,57801046.jpg
43796551,Бусина,фаянсовая.,Археология,53887039.jpg
8380104,Зеркало медалевидное с остатками ремешка в петельке,"Зеркало медалевидное с остатками ремешка в петельке, бронзовое (полевой шифр СХ2\5-36)",Археология,4613693.jpg
10434939,Сосуд лепной сероглиняный  баночной формы. II – III вв. до н.э.,,Археология,41363860.jpg
43788915,Фрагмент стенок мареных сосудов.,,Археология,53875707.jpg
43793826,Стенка сосуда (фрагмент) прямого венчика эпохи бронзы с редким тычковым орнаментом,"Срез прямой, по нему косые оттиски гребенчатого шщтампа, валик смят наружу",Археология,53883334.jpg
43788890,Фрагмент венчика миски мареной с незначительным лощением.,(в наборе 24 предм),Археология,53875684.jpg
10660579,Полусферическая бляшка от украшения.,Бляшка имеет отверстие  по центру для крепления к ремню.  Края по контуру имеют волнообразный профиль.,Археология,7850328.jpg
10442748,Флакон красноглиняный амфоровидной формы.  III – II вв. до н.э.,,Археология,41363881.jpg
10670536,Крестик-тельник,,Археология,27827882.jpg
1450164,Нож. Коллекция: Материалы раскопок селища Весь в 1987 г.,,Археология,53886354.jpg
43793821,Стенка сосуда (фрагмент) с ямочным орнаментом. Площадь обломка 1 - 1:5 см,,Археология,53883329.jpg
1450411,Браслета фрагмент. Коллекция: Материалы раскопок селища Весь в 1988 г.,,Археология,53887282.jpg
10688886,Подвеска нашивная.,"Бронзовая, состоящая из двух блях и бубенчика, соединенных в ""цепочку"" верхняя бляха – округлой формы со сквозными отверстиями, образующими внутри окружности окружность, внутри которой выполнен контур квадрата по наружной стороне первой окружности имеются четыре утолщения округлой формы с тонкими продольными линиями, одно со сквозным округлым отверстием для крепления. Наружная поверхность окружностей и квадрата украшены поперечными выпуклыми точками. К петле разъемным звеном укреплена бляха округлой формы со сквозными отверстиями, образующими крест. Поверхность окружности украшена частыми поперечными насечками. Книзу этой бляхи подвешен, на неразъемной петельке, бубенчик овальной формы, украшенный поясом прочерченной ромбической сетки, ограниченной поясами прочерченных горизонтальных линий, в нижней части – щелевая прорезь - резонатор неправильной формы.",Археология,7888038.jpg
43795053,Скол камня,Отходы камнеобработки,Археология,53884791.jpg
43796562,Бусина,"стеклянная, округлой формы.",Археология,53887048.jpg
46780203,Бусина,свинцовая.,Археология,57812383.jpg
47728368,Осколок глиняного сосуда с кругло-ямочным крупным орнаментом,,Археология,59108571.jpg
1450205,Нож. Коллекция: Материалы раскопок селища Весь в 1987 г.,,Археология,53886302.jpg
10314737,"Унгвентарий - флакон, красноглиняный веретенообразной формы. III–II в до н.э.",,Археология,41226693.jpg
10679586,Фрагмент керамики,,Археология,7876005.jpg
10335136,Фрагмент венчика красноглиняной чаши с процарапанным  клеймом …АВН. II-III вв.,,Археология,41202246.jpg
43793402,Образец керамики с ямочно-гребенчатым орнаментом,Коллекция керамики с ямочно-гребенчатым орнаментом. Собрана в местности Старцев остров Белозерского района.,Археология,53882972.jpg
43795692,Сосуда фрагмент,"темноглиняного, лепного, с лощением.",Археология,53885703.jpg
43796323,Стенка сосуда (фрагмент) с сетчатым орнаментом,,Археология,53886557.jpg
49040077,"Гвоздь, фрагмент",Четырехгранный,Археология,61029051.jpg
10335502,"Фрагмент краснолаковой чаши, с высоким отогнутым наружу краем венчика, на кольцевом поддоне (восстановленный профиль).  IV в.",,Археология,41201079.jpg
43788505,Плитка керамическая отделочная (фрагмент),,Археология,53875206.jpg
49038821,"Гвоздь, фрагмент","Четырехгранный, шляпка большая",Археология,61027837.jpg
49038852,Гвоздь,Четырехгранный,Археология,61027864.jpg
10669777,Пряслице,"глиняное, точеное, сверленое, из стенки сосуда.",Археология,7861980.jpg
43794535,Зуб мамонта,,Археология,54021735.jpg
43793799,Стенка сосуда (фрагмент) с тычковым орнаментом,,Археология,53883319.jpg
43787257,"Сосуд красноглиняный, венчик (фрагмент)",,Археология,53872852.jpg
10619967,Нож,,Археология,27840521.jpg
10669839,Игрушка - коник (фрагмент - шея),"красноглиняная, лепная, со сплошным белым ангобом.",Археология,7862049.jpg
43786653,Образец керамики с ямочно-гребенчатым орнаментом,Коллекция керамики с ямочно-гребенчатым орнаментом. Собрана в деревне Яковлевское Белозерского района.,Археология,53871808.jpg
10501475,Голова в тиаре,,Графика,7635001.jpg
10501388,Пошли мимо Садко девицы-красавицы... ,,Графика,7634827.jpg
4192138,"Туз червей, из колоды карт игральных, трансформационных ""Карточная шутка""",,Графика,22971804.jpg
22828057,"Иллюстрации к Библии (Сошествие Христа во Ад), гравюра",,Графика,24669505.jpg
4408816,"Тарок ХХ - LE JUGEMENT (суждение, справедливость), из колоды карт игральных ""Марсельский тарок""",,Графика,22970640.jpg
4198459,Тележка с газированной водой. Рисунок,,Графика,24794181.jpg
9991584,Иконный образец. Святитель Николай.,,Графика,6863389.jpg
4278111,"Тройка треф, из колоды карт игральных, антирелигиозных.",,Графика,22969545.jpg
34944276,Милютин Дмитрий Алексеевич,,Графика,41571751.jpg
10560092,Графика. Портрет графа Остермана Андрея Ивановича (1666-1747).,"В овале поясное изображение 3/4 влево.В длинном парике,с орденской лентой и звездой Андрея Первозванного.",Графика,7712681.jpg
10501428,Пейзаж с фигурой святого,,Графика,7634874.jpg
4201274,"Обложка книги ""Фата Моргана (Мужики)"" Я.А. Мамонтова (по повести М.М. Коцюбинского). Рисунок",,Графика,24793366.jpg
4408675,"Карта 34 - Chagrin, из колоды карт гадальных. Таро ""Большой Этейла I"".",,Графика,22970765.jpg
19941870,Эскиз «Сартак-пай»,"Рисунок сделан на листе белой бумаги. Изображен герой алтайского эпоса Сартакпай на фоне горного пейзажа, перекрывающий реку большим камнем. Изображен в воинских доспехах, на голове – шапка с кистью.",Графика,20648550.jpg
19939517,Листовка,Цветная. Портрет кандидата в депутаты Архангельского областного собрания Сергея Александровича Зарубина.,Графика,20645005.jpg
10501453,Бразильский мотив. Буэнос-Айрес.,,Графика,7634953.jpg
4945487,"Король червей, из колоды карт игральных с охотничьими сюжетами, прусский тип.",,Графика,22970997.jpg
10501429,"Композиция. ""Маскарад"".",,Графика,7634878.jpg
11770720,Лист плакатный «Наркомания – это смерть!»,,Графика,9342098.jpg
11480995,"Портрет Софьи Петровны Свечиной, гравюра",,Графика,25786843.jpg
9991584,Иконный образец. Святитель Николай.,,Графика,6863388.jpg
7312096,"Тройка пик, из колоды карт игральных, миниатюрных .",,Графика,22969081.jpg
19404612,Тишина. Линогравюра,,Графика,19875979.jpg
4192994,"Серия 2 ""Штык"". № 4 - Коленчатая прорезь трубки, из игры-пособия ""Винтовка""",,Графика,22969790.jpg
10684488,"Набросок фрагмента картины Рафаэля ""Преображение"". Фигура бесноватого юноши.",,Графика,7882545.jpg
10501451,Том и Бекки в пещере.,,Графика,7634944.jpg
10688399,"Богородица, Дево, радуйся (""Достойно есть"")(?)",,Графика,7887206.jpg
10501484,Театрализованная сцена с всадником на фоне города,,Графика,7635010.jpg
4278958,"Король пик, из колоды карт игральных, пасьянсных ""Лубочные""",,Графика,22968513.jpg
10680889,Эскиз представления. Лошадки.,,Графика,7877480.jpg
11773336,Портрет фельдмаршала,,Графика,9345501.jpg
4278198,"Дама бубен, из колоды карт игральных, антирелигиозных.",,Графика,22969447.jpg
10684484,"Набросок фигуры служанки из композиции ""Юдифь и Олоферн"" из росписи плафона Сикстинской капеллы. ",,Графика,7882532.jpg
24120165,№ 346.  Calèche Menguelbeer pour l'été et l'hiver. Exposу sour le № 340.,,Графика,26454585.jpg
4278768,"Картонаж для карт ""домино"" (рекламных - компания ""Зингер"").",,Графика,22971016.jpg
7313323,"Валет червей, из колоды карт игральных (Карты для дам) ""Четыре части света""",,Графика,22969076.jpg
10681277,Рим. Колоннада собора св. Петра.,,Графика,7878046.jpg
10682061,"Рог изобилия.Зарисовка к декору магазина ""Гастроном"" на Кудриской площади, бывшей пл. Восстания",,Графика,7879163.jpg
4192598,"Карта с эмблемой артиллерии. Девятка, из колоды карт игральных ""Военные""",,Графика,22970793.jpg
10682059,"Заяц.Зарисовка к декору магазина ""Гастроном"" на Кудриской площади, бывшей пл. Восстания",,Графика,7879160.jpg
22924786,"Плакат. Окно ТАСС «Вперед, на защиту социалистической родины!»",,Графика,24798317.jpg
19941174,"Открытка. Слава борцам за свободу / Набор открыток. Из истории русской революционной открытки. - Москва: издательство ""Изобразительное искусство"", 1974 г","1 лист, черно-серая печать, с горизонтальным  размещением изображения. Лицевая сторона - монтаж из фотографий и акварельного рисунка. Слева вверху портрет лейтенанта Шмидта в овальной декоративной рамке с текстом. Вверху на ленте текст ""Слава борцам за свободу"". Внизу на рамке текст ""П.Шмидтъ"". Ниже фотография прямоугольной формы с горизонтальным размещением изображения крейсера на воде. Справа в декоративной рамке рисунок, изображающий бой на море, справа развевающийся флаг. Вверху текст. Внизу на рамке текст ""1905. 15 ноября. Очаковъ"". Оборотная сторона - текст",Графика,20647897.jpg
7312670,"20 - Суд, из колоды карт игральных, тарок.",,Графика,22968625.jpg
7312865,"Карта № 7, из набора карт для игры в ""Ку-ку""",,Графика,22970164.jpg
10263083,В мастерской.,,Графика,7301720.jpg
4278146,"Десятка червей, из колоды карт игральных, антирелигиозных.",,Графика,22969796.jpg
10670394,Белый ломберный.,,Графика,7862736.jpg
11744865,Плакат «За мир свободный от курения».,,Графика,9310001.jpg
10501363,Тиханьское аббатство,,Графика,7634807.jpg
37267907,В поле.,,Графика,44773178.jpg
7312620,"Валет червей, из колоды карт игральных ""Революционные""",,Графика,22970446.jpg
15159234,Портрет товарища.,,Графика,13984962.jpg
14379870,Солдат. Рисунок,,Графика,14130824.jpg
17074602,[Освобождение Европы]. Рисунок,Студия военных художников им. М.Б. Грекова.,Графика,16688874.jpg
10501450,Сцена проповеди,,Графика,7634942.jpg
38051644,Конец колчаковщины,"Многофигурная композиция в зимнем пейзаже с изображением заснеженного поля. На первом плане поколенные изображения в профиль вправо: слева - фрагментарно видимых, смеющихся девушки в красном платке, темном полушубке и бордовой юбке, указывающей вперед пальцем, и за ней, правее - парня в коричневой ушанке и полушубке справа - идущего бородатого пожилого мужчины в папахе, коричневом полушубке, с гранатами у пояса и ружьем за спиной. На втором плане - колонна движущихся вправо военных в серых шинелях, слева направо: с рыжими усами в папахе в головном уборе с длинным козырьком с седыми усами и бородкой толстый, рыжий священник в облачении усатый, в папахе и другие, фрагментарно. За колонной, победренно - два конных красноармейца в буденовках слева - в 3/4 вправо, посередине - анфас, смеющийся. Дальний план: покосившиеся столбы с оборванными проводами, брошенный возок, полуразрушенные небольшие постройки на фоне пасмурного сине-серого неба. В правом нижнем углу тушью, пером авторская роспись.",Графика,45832782.jpg
21615937,Плакат «Слава труду учителя!»,Изображена молодая учительница в синем платье и портреты учеников в рамках. В центре надпись: Школа. Надпись вверху: Слава труду учителя!,Графика,22972071.jpg
10600400,Графика. PEDICULARIS SCEPTRUM. Вшивник Скиптр,Изображение растения с натуры,Графика,7766804.jpg
4192285,"Туз бубен, из колоды карт игральных.",,Графика,22971155.jpg
11740644,Рисунок  «Автопортрет»,"Погрудный портрет.В возрасте , с короткой стрижкой, в рубашке с галстуком. Лицо серьезное.",Графика,9304834.jpg
4945755,"Десятка бубенцов, из колоды карт игральных, с охотничьими сюжетами (прусский тип)",,Графика,22971047.jpg
10682026,Аналав для схимы преп. Сергия,,Графика,7879112.jpg
38051578,Робеспьер,"Изображение идущего, профиль влево, пожилого мужчины в парике и рединготе с широкими лацканами - отложным воротником с высокой стойкой, из-под которой видно кружевное жабо. Идет, наклонясь, вперед и размахивая руками. Лицо острое, худощавое. Слева, на дальнем плане фигура стоящего мужчины в треуголке, со шпагой. Справа - две фигуры - мужская и женская, в шляпах с высокими тульями. Над фигурами аппликация в виде двух параллельных прямоугольников - красного и синего. Под оттиском авторская подпись карандашом: ""Памяти героев Якобинской диктатуры ""Робеспьер"" сухая игла Домашенко 1974 г.""",Графика,45832696.jpg
4192367,"Девятка пик, из колоды карт игральных.",,Графика,22971383.jpg
24120194,№ 269. Calèche 1/2 Wourtz.,,Графика,26454613.jpg
10637815,Графика. Романтический пейзаж.,Русские пейзажи. Гравюры на дереве. 9 л.+ 1л. Предисловие,Графика,7819514.jpg
