object_id,name,description,group,img_name
11821040,Семена. Бирючина обыкновенная Ligustrum vulgare,Из коллекции семян лесообразующих пород Брянской области,Естественнонауч.коллекция,9407186.jpg
9992980,Раковина. Морской моллюск,"Раковина. Арка.  Створка раковины толстостенная, сильно выпуклая,  овально-трапециевидная. Макушка высокая, загнутая к краю. Наружная поверхность створки неровная, ребристая с линиями нарастания.. Край створки раковины зубчатый. Окраска розовато-белая, полосчатая. Внутренняя поверхность белая.",Естественнонауч.коллекция,6864623.jpg
8245014,Чучело. Собака с пересаженной на шею головой щенка. Canis familiaris L.,,Естественнонауч.коллекция,4411879.jpg
9263685,"Окаменелость ""Анатрипа""",Семейство AtrypidaeОтряд AtrypidaРаковина серого цвета.,Естественнонауч.коллекция,9417026.jpg
22928873,Гербарий. Щучка дернистая. Deschampsia cespitosa (L.) P.Beauv.,,Естественнонауч.коллекция,24804160.jpg
24380567,"Раковина морского моллюска. Мурекс - багрянка. Bolinus brandaris, L., 1758","Раковина плотная с кракивой мощной скульптурой, сифональный вырост длинный и узкий, два спиральных ряда шипообразных выростов..",Естественнонауч.коллекция,26834287.jpg
21624760,Гербарий. Лук угловатый (Allium angulosum L.) ,,Естественнонауч.коллекция,22982639.jpg
8244991,Чучело. Голубь беспородный. Columba livia domestica Gm.,,Естественнонауч.коллекция,4411792.jpg
9045142,"Палеонтологический образец. Череп и два фрагмента нижней челюсти барсука. Meles meles (Linnaeus, 1758)",,Естественнонауч.коллекция,5509808.jpg
24380500,"Раковина морского моллюска. Таис интермедия. Thais intermedia, Kiener, 1836.","Раковина  спирально-закрученной формы, по всей поверхности спиральный рельеф с зубообразными выростами темноокрашенными выростами. Цвет: Серый, черный.",Естественнонауч.коллекция,26834218.jpg
5750969,Раковина. Устрица. Gryphaea delatata Sow.,,Естественнонауч.коллекция,14623246.jpg
25586769,ГербарийЗемляника,,Естественнонауч.коллекция,28509993.jpg
10333341,Чучело. Круглоносый плавунчик. Phalaropus lobatus (L.),,Естественнонауч.коллекция,7399646.jpg
11836391,Горошек заборный Vicia sepium L.,Из гербария «Виды растений флоры Брянской области»,Естественнонауч.коллекция,9425825.jpg
10365850,"Гнездо ""Гнездо дрозда-дерябы""",Семейство Дроздовые - TurdidaeОтряд Воробьинообразные - PasseriformesГнездо сплетено из травянистых толстых растений. Подстилка гнезда состоит из толстого слоя измельченных сухих растений. Основание и стойки гнезда сцементированы глиной и грязью.,Естественнонауч.коллекция,9465522.jpg
10333540,"Палеонтологический образец. Мшанка. Diplotrypa petropolitana (Nicholson, 1879)",,Естественнонауч.коллекция,7400471.jpg
10333359,Чучело. Обыкновенный фламинго. Phoenicopterus roseus Pall.,,Естественнонауч.коллекция,7399736.jpg
17872541,Горошек мышиный (Vícia cracca). Семейство бобовые.,Гербарный лист в бумажной рубашке. В левом верхнем углу штамп  «ХАБАРОВСКИЙ КРАЕВОЙ МУЗЕЙ».,Естественнонауч.коллекция,17793511.jpg
9806804,Шерстистый носорог (Coelodonta antiquitatis). Боковая затылочная кость,"Цвет светло-коричневый, присутствует умеренный вивианит.",Естественнонауч.коллекция,6574971.jpg
13877243,Гербарий. Нефрома арктическая,"листоватый лишайник, лопасти таллома широкие с куравыми краями желтовато-зеленые сверху, снизу - черные с широкой белой полосой по краю, апотеции  крупные, коричневые по краю таллома",Естественнонауч.коллекция,12222744.jpg
21624722,Гербарий. Торица полевая (Spergula arvensis L.) ,,Естественнонауч.коллекция,22982600.jpg
14035213,Гербарий. Ряска малая. Из коллекции Якутской  экспедиции АН СССР . 1925 г.,На листе хакреплены 3 типовых экземпляра.,Естественнонауч.коллекция,12417040.jpg
3813494,Гербарий. Ситник сплюснутый,"Ситник сплюснутый - растение семейства ситниковые (вид переопределен в 2018 г.). На двойном сложенном альбомном листе пришитое засушенное растение, этикетаж автора",Естественнонауч.коллекция,4188300.jpg
19957758,Гербарный лист. Ясколка крупная,,Естественнонауч.коллекция,20669814.jpg
10333351,Чучело. Белка-телеутка. Sciurus vulgaris exalbidus Pall.,,Естественнонауч.коллекция,7399698.jpg
27791904,"Песчаник с отпечатками третичной флоры, олигоценовый возраст.",,Естественнонауч.коллекция,31686644.jpg
10333349,Чучело. Серый гусь. Anser anser (L.),Клюющий.,Естественнонауч.коллекция,7399686.jpg
10100001,Скелет. Настоящие лягушки,Скелет на подставке,Естественнонауч.коллекция,7023730.jpg
37306095,Гербарий. Картофель,,Естественнонауч.коллекция,44824792.jpg
37304462,"Гербарий. Качим постенный, или стенной",,Естественнонауч.коллекция,44822570.jpg
10096637,Чучело. Удод. Upupa epops L.,,Естественнонауч.коллекция,7017140.jpg
29253200,Окаменелость каменноугольного периода.,,Естественнонауч.коллекция,33721542.jpg
7853283,"Гербарий. Камыш морской. Из гербария ""Флора Ингрика"".","Многолетник с ползучим корневищем, стеблями высотой 50-100 см и линейными листьями шириной 3-8 мм. На вершине побега - плотное звездчато-зонтиковидное соцветие бурого цвета.",Естественнонауч.коллекция,3889071.jpg
22928906,Гербарий. Донник лекарственный. Melilotus officinalis Desr.,,Естественнонауч.коллекция,24804192.jpg
45199568,Сухой препарат. Афодий. Aphodius lividus,,Естественнонауч.коллекция,55715667.jpg
14035222,Гербарий. Осока бледная. Из коллекции Якутской  экспедиции АН СССР . 1925 г.,Типовые экземпляры.,Естественнонауч.коллекция,12417050.jpg
24380548,"Раковина морского моллюска. Латиаксис тортуозус. Mipus tortuosus Azuma, 1961","Раковина  спирально-закрученной формы, изящная, сифональный вырост удлинен, спиральный ряд шипообразных выростов, спиральная густая рельефная штриховка. Цвет: Белый, кремовый.",Естественнонауч.коллекция,26834268.jpg
9424266,"Скелет позвоночного. Бакулюм американского барсука. Taxidea taxus Schreber, 1777",,Естественнонауч.коллекция,6011616.jpg
6048390,Минерал. Мышьяк самородный с баритом.,"Мышьяк массивный с натёчной поверхностью, чёрного цвета, матовый. Барит розового цвета. Минерал из коллекции доктора геолого-минералогических наук И. И. Чупилина.",Естественнонауч.коллекция,2323894.jpg
10529664,"Чучело. Северный олень, самец","Крупное парнокопытное животное с небольшими узкими рогами. Окрас шерсти и ног тёмно-коричневый с широкой светлой полосой на боках. Голова и шея белые с тёмными ушами и верха головы. Шерсть густая, короткая на теле и удлинённая в нижней части шеи. Рога ветвистые, голые, серой окраски.",Естественнонауч.коллекция,7673079.jpg
45199596,Сухой препарат. Пчеложук иркутский. Trichodes ircutensis,,Естественнонауч.коллекция,55715695.jpg
11765063,"Бабочка Желтушка ракитниковая Colias myrmidone (Insecta: Lepidoptera, Pieridae).",,Естественнонауч.коллекция,9334114.jpg
8720867,Чучело глухаря,"Чучело из тушки глухаря. Крупная птица преимущественно черного цвета, с белыми вставками на брюшке, хвосте, крыльях, на груди явно заметный зеленый отлив. Красные веки.",Естественнонауч.коллекция,5092240.jpg
17872504,Брусника (Vaccinium vítis-idaea). Семейство вересковые.,Гербарный лист в бумажной рубашке. В левом верхнем углу штамп  «ХАБАРОВСКИЙ КРАЕВОЙ МУЗЕЙ».,Естественнонауч.коллекция,17793472.jpg
10100025,Сухой препарат. Рак из Тюмени. Перевалова З.М.,Панцирь рака речного,Естественнонауч.коллекция,7023774.jpg
8245020,Чучело. Турухтан. Philomachus pugnax (L.),,Естественнонауч.коллекция,4411914.jpg
19950765,Сухой препарат. Чехлик личинки ручейника Trichoptera Сем. Limnephilidae,,Естественнонауч.коллекция,20660583.jpg
19937444,Композиция.,"Трехчастная композиция на фиолетовом фоне. По бокам изображенные по вертикали извивающиеся, подобно змеям ленты. В центре четыре ромба на темном фоне. Между изгибами лент и в ромбах расположены круги.",Живопись,20642680.jpg
8880455,Граф Лев Николаевич Толстой в своем кабинете в Ясной Поляне,"Сидит в кресле, перед круглым столом, пишет, направо - письменный стол, на стене картины",Живопись,5296891.jpg
4782773,Дидона,,Живопись,1269046.jpg
8881185,"Дом-Музей на станции Астапово зимой, со стороны двора","Справа дом с двумя окнами и крыльцом к крыше дома приставлена лестница. На втором плане забор с приоткрытой калиткой сзади каменные дома, освещенные солнцем. У дома и на дворе большие сугробы снега. Голубое безоблачное небо. В этом доме 7/20 ноября 1910 года в 6 час. 5 минут утра скончался Л.Н. Толстой",Живопись,5297627.jpg
8463878,"Старик, ты гений. ",,Живопись,4742325.jpg
30275226,Вид Останкина,,Живопись,35116989.jpg
30275330,Портрет купца Петра Семеновича Сапожникова,,Живопись,35117100.jpg
11834566,Звук бубна,,Живопись,9423401.jpg
19937116,Квартира художника,"Колорит картины насыщенный, в красно-оранжевой цветовой гамме с отдельными яркими голубыми, лимонными, сине-зелёными пятнами. На переднем плане в глубоком кресле фигура В.С.Сорокина. Перед ним мольберт. Интерьер комнаты прост: стол, шкафчик с телевизором, тахта с пёстрым ковром над ней…",Живопись,20642264.jpg
4754267,Женский портрет,,Живопись,1249936.jpg
10331374,"Портрет Петухова. Коллекция живописи Л.Р.Сологуб, картина","Портрет усатого военного с длинным острым носом. Одет в гимнастерку, на плечах погоны.",Живопись,7396154.jpg
19941911,Этюд «Сосна»,"Этюд. На первом плане справа два сухих ствола, расположенных рядом, слева – сосна. Второй план – река, расположенная справа налево (слева – не прорисовано), за рекой – полоса леса. Дальний план занимает изображение леса, голубое небо.",Живопись,20648590.jpg
7768358,"Картина ""Композиция 1005""",Представлена абстрактная композиция в многоцветовой гамме. В середине коричневая петелька с двумя перемычками.,Живопись,3771172.jpg
10297274,Храм,,Живопись,7347976.jpg
21625480,Пейзаж. У реки.,"В центре высокий берег реки, поросший густой серебристо-зеленой растительностью, которая отражается в спокойной глади воды. Справа открытая лужайка. На втором плане густой массив леса.",Живопись,22983652.jpg
8359448,Вид Казани с набережной.,"Зимний городской пейзаж с изображением замерзшей реки слева. Справа деревья, за ними дорога, тянущаяся вдоль реки. На втором плане, справа,, городские строения, цирк, на возвышенности Кремль.",Живопись,4581734.jpg
8922510,"Картина ""Стволы""","Поздняя осень. На переднем плане крупный стволы берез, позади лес",Живопись,5351037.jpg
19943222,"Этюд ""Дебаркадер"" (синий).","Живопись на картоне, без рамы. Горизонтальное изображение синего дебаркадера с мостиком у песчаного берега на широкой голубой реке. За дебаркадером - большой 2-х палубный теплоход. Вдали на горизонте - тонкая темная полоса противоположного берега под узким небом.",Живопись,20651051.jpg
22927388,"фрески фрагмент, фон",,Живопись,52929486.jpg
4027262,"Рыбаки, картина","В центре, на плоском песчаном берегу моря стоит большая лодка, к мачте которой привязаны рыболовные сети. На лодке и рядом толпятся люди. Справа - спокойное море, на котором виднеются паруса лодок. Слева группы людей, вдали несколько домиков и высокая башня.",Живопись,55087579.jpg
5741636,Неравный брак,,Живопись,1956307.jpg
11821616,Картина,"В. Панченко ""Храм в Надеждино"", написана маслом.",Живопись,9408129.jpg
27789947,Зимний лес,,Живопись,31682315.jpg
7135712,Картина. Смена.,,Живопись,3093875.jpg
11065398,Восточные мотивы,"Натюрморт на фоне полосатых тканей, состоящий из кумгана с гранатом наверху лежащими на столе фруктами: хурма, гранаты, два банана. Слева две фигурки верблюдов",Живопись,8403282.jpg
17074587,Вечная слава. Живописная работа,,Живопись,16688859.jpg
10331536,"Портрет ездового Иванова. Коллекция живописи Л.Р.Сологуб, картина",Профильный портрет мужчины с взлохмаченными волосами. Вверху - 63. Внизу справа - на наклеенной на основу белой бумаге написано: Иванов N ездовой. Внизу слева  - архив 817/75.,Живопись,7396377.jpg
17428491,«Столбы – въезд в усадьбу Л.Н.Толстого Ясная Поляна. Зима».,"Вид въезда в усадьбу Л.Н.Толстого в Ясной Поляне. На первом плане, в центре, белые цилиндрические башни въезда в снегу. С правой стороны фрагменты ограды. По левому краю фрагменты ограды и здания сторожки. На втором плане, в центре, по правому и левому краям, деревья. На заднем плане парк. Преобладают охристые и синеватые тона.",Живопись,17179771.jpg
14037060,Лунный Брюссель,"Летний пейзаж. В центре изображена площадь Гранд-Плас (Брюсель), вокруг - постройки (город). Изображение условное. Основной цвет синий.",Живопись,12419367.jpg
10297266,Эфир,,Живопись,7347967.jpg
8824897,Портрет неизвестного,,Живопись,5218990.jpg
25588737,"Рисунок художника Александра Григорьевича Сердюкова ""Поздняя осень""",,Живопись,28512510.jpg
11882304,"Картина ""Каменные ворота""",,Живопись,9487082.jpg
9799082,Икона «Явление Преподобному Сергию Богоматери с двумя апостолами Петром и Иоанном».,"С правой стороны изображен святой Преподобный Сергий на коленях, со сложенными в молитве руками, за ним, спиной к нам и к Богородице, сидит на полу святой Преподобный Михей. В центре изображена Богоматерь, одной рукой она придерживает одеяние, другой тянется к Сергию. Сзади Богородицы стоят апостолы Иоанн и Петр, за Петром проем двери. В верхней части старозаветная троица.",Живопись,6563471.jpg
30275401,Иллюминация Останкина,,Живопись,35117180.jpg
10023577,"Сильней свинца и стали. Из серии ""Зарубежная хроника""",,Живопись,6906085.jpg
8881217,Осень в яснополянском парке,"Клины в яснополянском парке вид старинной липовой аллеи, усыпанный желтыми листьями. По обеим ее сторонам толстые почерневшие стволы высоких лип с оголенными сучьями. С правой стороны скамейка и желтая листва молодых деревьев. В конце аллеи идущая женщина. Сквозь ветви деревьев просвечивает светло-серое небо. Липовые аллеи в ""Клинах"" - деревья были посажены дедом Л.Н. Толстого кн. Н.С.Волконским. В одном из вариантов к ""Войне и миру"" упоминается о липовых аллеях в ""Лысых горах"". С.Л.Толстой. Ясная Поляна в творчестве Л.Н. Толстого ""Ясная Поляна"". Статьи и документы"". Полит. издат., 1942, стр. 94. ""Клины"" неоднократно упоминаются Л.Н. Толстым : в ""Воспоминаниях"", письмах и дневниках",Живопись,5297659.jpg
7768297,"Картина ""Посвящение Шимасу""","Представлено стилизованное изображение человека, сидящего на полу опираясь локтем о круглую  подушку. На заднем плане картина в коричневой рамке.",Живопись,3771110.jpg
10965026,"Картина ""Рыбаки""Художник  Лихин Петр Константинович.Холст, масло , первая половина 20 века.","Картина ""Рыбаки""Художник  Лихин Петр Константинович.Холст, масло , первая половина 20 века. Двое мужчин тянут сеть,на берегу сидит оголенная по  пояс.",Живопись,8271937.jpg
8363653,Крыши. картина,Фиолетово-коричневая деревянная двускантная крыша на фоне зеленых деревьев и яркой красно-оранжевой стены дома с двумя окнами в правой части.,Живопись,7115843.jpg
30275246,Портрет княгини Марии Юрьевны Черкасской,,Живопись,35117008.jpg
8824924,Пейзаж с соснами,,Живопись,5219002.jpg
25587493,Автопортрет в картузе,Погрудный портрет мужчины в тёмно-синем картузе. Мужчина изображен на фоне серо-зелёной стены. Его взгляд устремлён на зрителя.,Живопись,28511011.jpg
9400174,Начало зимы,,Живопись,5978710.jpg
34945800,Вынос плащаницы,"В центре картины над лестницей перед церковью стоят двое мальчиков, их лица освещены зажженной свечой, которую они заслоняют фуражкой, за ними стоит молодая женщина, одетая в серое пальто и черный платок. На заднем плане справа стоит группа женщин и священник с кадилом в руках. Вдали видна светлая извилистая река и город слегка намеченный в серой туманной дымке.",Живопись,41573510.jpg
11884704,Свидание,,Живопись,9490316.jpg
10155091,На даче. Охотино,,Живопись,7132388.jpg
