object_id,name,description,group,img_name
4702442,Винтовка сист. Винчестер.,,Оружие,2003525.jpg
6339689,"Полусабля  солдатская, пехотная",,Оружие,2592049.jpg
9576381,Винтовка Верндля обр. 1867/77 г.,"Ствол конический, с выступом для штыка в дульной части. Мушка призматическая со скругленной вершиной. Прицел рамочно-ступенчатый, с выдвижной планкой. Ствольная коробка круглая. Затвор крановый. Курок внешний. Ложа с длинным цевьем, прямой шейкой и плоским прикладом. Наконечник цевья, ложевые кольца, антабки, затыльник приклада, спусковая скоба стальные. На казенной части ствола выбито: St 70 на ствольной коробке - WERNDL, 23 на замочной доске - LWURZINGER, 870 на прицельной колодке - ŒWG на прикладе справа - 388.",Оружие,6230333.jpg
1488234,Палаш парадный.,,Оружие,39442352.jpg
4702536,Пистолет кремневый.,,Оружие,2002312.jpg
4701780,Топор.,,Оружие,2009853.jpg
24885873,"Патрон учебный к винтовке и пулемету калибра 7,62 мм. ",,Оружие,28519652.jpg
4707436,"Меч правосудия, двуручный.",,Оружие,2003351.jpg
4706001,Сабля в ножнах (сабля),,Оружие,2001666.jpg
15112333,Патрон от берданки,,Оружие,13922221.jpg
10577589,Винтовка со скользящим затвором системы Бердана,"Ствол круглый, длинный, железный. Ложа с коротким цевьем и прикладом с железным затыльником.",Оружие,7735150.jpg
8744434,ружье,"Ружьё одноствольное шомпольное с ударно-капсульным замком калибра 14 мм. Состоит из ствола, замка, спускового механизма, ложи с прибором. Ствол железный, гладкий, круглый с незначительным утолщением в казенной части, с открытой мушкой и простым целиком. Замок ударно-капсюльный. Ложа – кустарной работы с шейкой винтовочного типа с цевьем на всю длину ствола. В нжней части цевья имеется канал для шомпола. Шомпол отсутствует. Ствол крепится к ложе посредством одного ложевого кольца с винтовым креплением и хвостового винта в шейку. Прибор ложи состоит из железного ложевого кольца и широкой бронзовой предохранительной скобы. Ремень кожаный, закреплен за антабку ложевого кольца и хвостовик основы предохранительной скобы. Ложа и шомпол кустарной работы. Ремень закреплен кустарно. На шейке ложа набита гвоздиками кожаная накладка. Длина ствола – 81 мм.",Оружие,5127962.jpg
11751329,Ножны кинжала криса,Ножны кинжала криса вырезаны из коричневого дерева с темными разводами. Прямой ствол ножен слегка сужается к закругленному концу. Верхняя поперечина («врангка») имеет фасолевидную форму и относится к типу «гаяман».,Оружие,9319104.jpg
21638655,Штык к самозарядной винтовке Симонова,,Оружие,23005759.jpg
6339650,"Сабля с кожаной портупеей и бляхой, украшенной бирюзой.(сабля)",,Оружие,2592028.jpg
12986210,Ствол 8-фунт. (102-мм) морской карронады обр. 1834 г.,,Оружие,11001154.jpg
4698538,Ятаган в ножнах,,Оружие,2002287.jpg
24886541,"Патрон учебный к винтовке и пулемету калибра 7,62 мм. ",,Оружие,28519058.jpg
4404923,Лядунка (патронная сумка) офицера кавалерии Австрийской империи.,"коробка из плотной кожи в форме параллелепипеда, обтянутая тонкой кожей красного цвета. Крышка металлическая, фигурной формы, с закругленными углами, по наружному краю крышки идёт позолоченный бортик с растительным орнаментом в районе угловых закруглений. Внутренняя поверхность крышки обтянута тонкой кожей красного цвета. На боковых стенках лядунки закреплены посеребренные пластинки с изображением так называемых «воинских арматур» или «трофеев» — знамен, старинных пушечных стволов и ядер, скрещенных сабель, пик и т.п. На крышке, посредине, с помощью винта и гайки закреплён рельефный позолоченный герб Австрийской империи: двуглавый коронованный орел, держащий в правой лапе меч, а в левой - державу, на груди орла фамильный щит Габсбургов-Лотарингии – дважды рассеченное поле: в первом  изображен вооруженный и коронованный лев (графство Габсбургское) во втором поле - пояс (Австрия) с монограммой ""FII"", расположенной в центре в третьем поле - перевязь, обремененная тремя летящими серебряными алерионами (орел, лишенный клюва и лап), положенными сообразно перевязи (герцогство Лотарингия). На задней стенке, снаружи, закреплены две петли для перевязи. На нижней стенке, снаружи, расположены: 1) рамочная пряжка с подвижным язычком и неподвижной шлейкой 2) металлическая защёлка со шпеньком и подпружиненной пластинкой для фиксации ремешка с отверстием, закреплённого на крышке коробки. Внутри лядунки, в месте соединения крышки и коробки, посредине, одним концом пришит  ремешок из красной кожи для облегчения доставания содержимого.",Оружие,22690804.jpg
10577581,Ружьё кремнёвое одноствольное,,Оружие,7735141.jpg
7672339,Подсумок для патронов к винтовке обр.1891/30 г.,"Состоит из сложенного и прошитого по краям куска брезента, загибающегося на лицевую сторону с пришитой петлёй и  кожаной пуговицей.Оборотная сторона имеет две лямки для поясного ремня.",Оружие,3640394.jpg
10619501,"Вкладыш в буклет «Изобильненский муниципальный район. Сохраняя традиции, внедряя инновации»","Вкладыш в буклет «Изобильненский муниципальный район. Сохраняя традиции, внедряя инновации» посвящен 90-летию Изобильненский муниципальный района.На вкладыше на желтом фоне в верхней части надпись синим цветом: ""90 лет Изобильненскому муниципальному району"", ниже размещены фотографии промышленных и культурных объектов района.",Печатная продукция,7793788.jpg
10401377,Газета. “Il Giornale d’Italia” № 232 от 30 сентября 1939 .,,Печатная продукция,7496655.jpg
18406136,открытка. Привет из Рыбинска. Гавань.,,Печатная продукция,18541035.jpg
19940581,Открытка  - почтовая карточка. С Новым годом!,"С вертикальным изображением. В рамке из снежинок в правой части - несколько веток ели, украшенных шарами, свечами. Сверху - на синем фоне - заглавная надпись. На оборотной стороне: герб, ""Почтовая карточка"", марка. В левой части - поздравление с Новым годом, адресованное Н.Н. Никифоровой  от Е. Дерновой, внизу - выходные данные.",Печатная продукция,20647129.jpg
27087335,Буклет. Композиторы Тамбовского края. Юрий Николаевич Гурьев (род.1928),"Буклет. Композиторы Тамбовского края. Юрий Николаевич Гурьев (род. 1928). Областная типография ""Пролетарский светоч"", Тамбов.",Печатная продукция,30645171.jpg
19940441,Карточка филателистическая в честь 50-летия переименования города Симбирска в город Ульяновск,"Типографская цветная печать. Со штемпелем спецгашения ""Филателистическая выставка Большая Волга-85. 08-14.04.1985. Ульяновск-почтампт"".",Печатная продукция,20646860.jpg
34944506,"Книга ""Наследственность и изменчивость, как причина болезней""",,Печатная продукция,41572063.jpg
8537897,"Газета. ""Правда""",№ 173. Орган Центрального комитета и МК ВКП(б).,Печатная продукция,14172436.jpg
14890817,Балатонсарсо. Памятник Аттиле Иожефу.   ,,Печатная продукция,13697119.jpg
11171932,"Газета. ""Боевая подготовка"" № 73.",Газета младшего начальствующего Состава Красной Армии.,Печатная продукция,14172276.jpg
13249399,"Газета. ""Приуральская правда"" № 272.","Орган Западно-Казахстанского обкома и Уральского горкома КП(б)К, областного и городского Советов депутатов трудящихся.",Печатная продукция,14180715.jpg
34944511,"Книга ""Заметки по военно-полевой хирургии""",,Печатная продукция,41572071.jpg
30274996,"Газета ""Петроградская Правда"" № 85. 21 апреля 1920 г. Ежедневная газета на 2 стр.",,Печатная продукция,35116695.jpg
30274916,"Газета ""Петроградская Правда"" № 96. 5 мая 1920 г. Ежедневная газета на 4 стр.",,Печатная продукция,35116615.jpg
37305982,Газета «Курская руда».,Газета собрана в подшивку за 2005 год ручным способом.,Печатная продукция,44824668.jpg
11729055,"Бумажный денежный знак. Знак Меджибожского общества потребителей ""Защита"". 1 рубль. Украинская ССР","Бумага белого цвета, разлинованная. Надписи чёрного цвета. В центре билета - прямоугольная рамка. В верхней части рамки - надпись ""Меджибожское Общество Потребителей ""Защита"". В центре рамки надписи ""ЗНАКЪ НА"" и ""За отсутствiемъ мелкой монеты сей знакъ принимается за товары и обмънивается на украинскiя деньги"" (три строки). Слева и справа от надписей - вертикально расположенная надпись ""одинъ"" и номинал ""1 р."". В нижней части рамки - подписи заведующего (красные чернила) и кассира (чёрные чернила).Орнамент:",Печатная продукция,9289844.jpg
19940462,Карточка филателистическая в честь 50-летия переименования города Симбирска в город Ульяновск,"На  типографской карточке - типографский штемпель спецгашения: ""100 лет со дня рождения М.И. Ульяновой. 18.11.1978. Ульяновск. Почтампт"".",Печатная продукция,20646902.jpg
38765067,Книга «Отечественная война 1812 года». Энциклопедия.,"Книга «Отечественная война 1812 года». Энциклопедия. Бордовая с золотыми буквами обложка. Твердый переплет. Черно-белые и цветные иллюстрации. Москва, РОССПЭН, 2004. 880 стр.",Печатная продукция,46771028.jpg
10554458,"Брошюра. XVIII Международный фестиваль камерных спектаклей по произведениям Ф.М. Достоевского. 7-12 ноября. Великий Новгород - Старая Русса: программа / Министерство культуры РФ [и др.]. ‒ [Великий Новгород], 2014","Брошюра в издательской обложке зеленого цвета, иллюстрированной растительным орнаментом, стилизованным под обои. На первой странице обложки, в орнаментированной рамке: эмблема Министерства культуры РФ логотип Года культуры (2014) в цветном исполнении сведения об ответственности заглавие год стилизованное изображение человечка в пальто со шляпой в руке (один из символов фестиваля). На второй странице обложки - историческая справка о фестивале. На первой странице блока - программа фестиваля на второй странице - состав организационного совета и члены жюри, дана краткая информация об этих лицах. На 6-14 страницах напечатаны сведения о спектаклях, которые были показаны на фестивале. На третьей странице обложки - логотипы и справочная информация об учреждениях, которые приняли участие в проведении фестиваля на четвертой - адресные данные. Печать многоцветная. В тексте представлены цветные и черно-белые иллюстрации. В пагинацию включены первая и вторая страницы обложки.",Печатная продукция,49958137.jpg
18404854,"открытка, г. Кострома. Вид с Костромского берега по Волге.",,Печатная продукция,18539572.jpg
10600860,Книга. Корепанов А.Г. Сюиты для двух фортепиано. Нотное издание.,,Печатная продукция,7767430.jpg
9689552,"Газета. ""Красный воин"" № 9.",Красноармейская газета Московского Военного округа. Ответственный редактор - М.В. Погарский. 2 л.,Печатная продукция,14167426.jpg
19941044,"Открытка почтовая. Репродукция работы Симоне ""Анатом сердца"".",,Печатная продукция,20647853.jpg
10621959,Листок рекламный «Портативные кассовые аппараты «Экр. миника для рыночной торговли»,"Рисованное изображение человека с кассовым аппаратом, логотип з-да «Счетмаш». Оборот клеевой с защитным бумажным слоем",Печатная продукция,7797442.jpg
11169668,"Газета. ""Красный воин"" № 214 (6086).",Красноармейская газета Московского военного округа,Печатная продукция,14178051.jpg
12541964,"Книга. ""Storm over the Land. A Profile of the Civil War"" (""Буря над землей: описание гражданской войны"").",На английском яз. 8 стр.+440 стр.+16 л. с илл.,Печатная продукция,14129865.jpg
10589282,"Книга. ""Эпос профессора Микушева"".","Книга в твердом издательском переплете голубого цвета. На верхней крышке переплета – автор и название книги, в центре – портрет А.К.Микушева в исполнении художника Э.В.Козлова. На корешке - автор и название книги.",Печатная продукция,7750564.jpg
10408394,"Афиша. Филиал ГАБТ СССР. 28 мая, 1 и 5 июня.Декада башкирской литературы и искусства в Москве. Башкирский государственный театр оперы и балета. ""Журавлиная песня"", балет, музыка Л. Степанова. Дирижер Г. Муталов. Постановка Н. Анисимовой. Художник М. Арсланов. - Москва, 1955 г.",,Печатная продукция,7507376.jpg
10559221,Книга. Иогансон - Гегель. Deutsch. Учебник немецкого языка для средней школы.,"Иогансон - Гегель. Deutsch. Учебник немецкого языка для средней школы. Часть I. Для пятого и шестого классов. Утверждено Наркомпросом РСФСР. Четвертое издание. Москва - Ленинград: Государственное учебно-педагогическое издательство. 1935. Переплет, 44 л.",Печатная продукция,7711419.jpg
40070178,"Газета. Русская жизнь. № 8950, 16 августа 1978 г.",,Печатная продукция,48671354.jpg
13249849,"Газета. ""Советская Хакассия"" № 176.","Орган Хакасского обкома, Абаканского горкома ВКП(б) и областного Совета депутатов трудящихся.",Печатная продукция,14156458.jpg
21472922,Алексис Киви. 1932 - 1934 гг. Бронза. (Ск. Вяйне Аалтонен).,,Печатная продукция,22763430.jpg
19627198,"открытка, г. Углич. Спасо-Преображенский собор. № 21.",,Печатная продукция,20198980.jpg
22923199,Книга. Аксаков С.Т. Собрание сочинений в пяти томах.,"Б-ка ""Огонек"", из-во ""Правда"". М 1966, тв\п.",Печатная продукция,24791971.jpg
10405407,"Газета ""Юность News"" (выпуск № 8, апрель 2009 г.).","Газета танцевального коллектива ""Юность"", главный редактор Денис Ляпин, на 16 страницах, посвящен апрельским событиям в жизни коллектива ""Юность"". На 9 странице рубрика ""Лицо номера"", посвященная художественному руководителю А.Д. Сазонову, его профессиональной, гастрольной и семейно-личной жизни.",Печатная продукция,7502853.jpg
11736343,"Открытка почтовая ""С Новым годом!""","На голубом фоне изображены стволы берез, Дед Мороз с посохом в руке. Справа на ветках два снегиря.",Печатная продукция,9299278.jpg
19940679,Открытка  - почтовая карточка. 1 Мая,"С горизонтальным изображением. На фоне цветущих веток яблонь - Спасская башня Кремля. На оборотной стороне: ""Карточка почтовая"", марка. В левой части - письмо-поздравление, адресованное Н.Н. Никифоровой и её родным от плямянников, два почтовых штемпеля.",Печатная продукция,20647344.jpg
30275003,"Газета ""Петроградская Правда"" № 114. 27 мая 1920 г. Ежедневная газета на 2 стр.",,Печатная продукция,35116702.jpg
10298569,"Газета. ""Фронтовик"" № 152.",Ежедневная красноармейская газета 3-й ударной армии,Печатная продукция,14152925.jpg
10584856,Брошюра. 50 лет Детской музыкальной школе № 3,28 с. Тираж 3000. Крепление 2-мя скобами,Печатная продукция,21726847.jpg
10491696,"Городская газета ""Рабочая трибуна"" № 150 (2022), вторник, 18 декабря 1973г.",,Печатная продукция,15041018.jpg
10437345,Плакат «Куба – Да!» из альбома - выставки  «Борясь за мир – не забывай … ». Художник Корецкий В.Б.,Плакат «Куба – Да!» из альбома - выставки  «Борясь за мир – не забывай … ». Художник Корецкий В.Б. Издательство «Советская Россия». Москва.,Печатная продукция,7545771.jpg
10557501,"Сборник ""День Победы приближали как могли. Оренбуржцы в годы Великой Отечественной войны 1941-1945 гг.""",Книга в твёрдом переплёте на лощёной бумаге.,Печатная продукция,7708922.jpg
11729109,"Марка почтовая Венгрия серии ""Семь чудес света"". ""Египетские пирамиды"". Номинал 5 форинтов.",,Печатная продукция,9289938.jpg
10601601,"Книга ""Большой словарь оружия""","Книга в черном переплете  с двойной, золотистой, тисненой  рамкой. В центре верхней крышки переплета –  золотистая надпись в четыре строки: «Б.Г. ТРУБНИКОВ/ БОЛЬШОЙ/ СЛОВАРЬ/ ОРУЖИЯ», вверху – надпись: «ВОЕННО-ИСТОРИЧЕСКАЯ БИБЛИОТЕКА», внизу – название издательства: «ПОЛИГОН». В центре корешка – золотистая надпись в три строки: «/ БОЛЬШОЙ/ СЛОВАРЬ/ ОРУЖИЯ». По обе стороны от надписи – золотистые сетки и параллельные линии.  Полное собрание терминов оружия и вооружения, от древнейших времен до наших дней. 672 с.",Печатная продукция,26286794.jpg
